{
  "$schema": "schemas/harness-manifest.schema.json",
  "schema_version": "jj-flow/harness/1.0",
  "record_system": {
    "maps": [
      {
        "id": "agent-map",
        "path": "AGENTS.md",
        "authority_for": ["agent-entrypoint", "global-invariants"],
        "max_lines": 80
      },
      {
        "id": "architecture-map",
        "path": "ARCHITECTURE.md",
        "authority_for": ["physical-codemap", "module-boundaries"],
        "max_lines": 180
      }
    ],
    "authorities": [
      {
        "id": "product-positioning",
        "path": "README.md",
        "authority_for": ["product-positioning", "public-entrypoints"]
      },
      {
        "id": "product-architecture",
        "path": "docs/architecture.md",
        "authority_for": ["product-architecture", "maintainer-boundaries"]
      },
      {
        "id": "design-index",
        "path": "docs/design-docs/index.md",
        "authority_for": ["design-discovery", "design-status"]
      },
      {
        "id": "harness-design",
        "path": "docs/design-docs/harness-engineering.md",
        "authority_for": ["harness-target-state", "autonomy-policy"]
      },
      {
        "id": "architecture-decisions",
        "path": "docs/adr/index.md",
        "authority_for": ["accepted-decisions", "adr-discovery"]
      },
      {
        "id": "exec-plan-index",
        "path": "docs/exec-plans/index.md",
        "authority_for": ["execution-plan-discovery", "execution-progress"]
      },
      {
        "id": "same-contract",
        "path": "skills/jj-same/SKILL.md",
        "authority_for": ["same-workflow-contract"]
      },
      {
        "id": "init-contract",
        "path": "skills/jj-init/SKILL.md",
        "authority_for": ["init-onboarding-contract"]
      },
      {
        "id": "ralph-contract",
        "path": "skills/jj-ralph/SKILL.md",
        "authority_for": ["ralph-workflow-contract"]
      },
      {
        "id": "ralph-run-schema",
        "path": "schemas/ralph-run.schema.json",
        "authority_for": ["ralph-run-ledger"]
      },
      {
        "id": "ralph-context",
        "path": "src/ralph/context.mjs",
        "authority_for": ["ralph-phase-context", "review-scope-snapshot"]
      },
      {
        "id": "git-end-runner",
        "path": "src/end.mjs",
        "authority_for": ["git-closeout-runner"]
      },
      {
        "id": "git-end-policy",
        "path": "skills/jj-end/references/git-policy.md",
        "authority_for": ["git-conflict-recovery"]
      },
      {
        "id": "ralph-map-schema",
        "path": "schemas/ralph-business-map.schema.json",
        "authority_for": ["ralph-business-map"]
      },
      {
        "id": "ralph-design",
        "path": "docs/design-docs/jj-ralph.md",
        "authority_for": ["ralph-target-state"]
      },
      {
        "id": "evaluated-design",
        "path": "docs/design-docs/jj-evaluated.md",
        "authority_for": ["evaluated-target-state", "evaluation-generalization"]
      },
      {
        "id": "evaluated-contract",
        "path": "skills/jj-evaluated/SKILL.md",
        "authority_for": ["evaluated-workflow-contract"]
      },
      {
        "id": "evaluated-runner-scripts",
        "path": "skills/jj-evaluated/scripts/evaluated_ops.mjs",
        "authority_for": ["evaluated-mvp-runner"]
      },
      {
        "id": "dispatch-contract",
        "path": "skills/jj-dispatch/SKILL.md",
        "authority_for": ["dispatch-workflow-contract"]
      },
      {
        "id": "control-plane-schema",
        "path": "skills/jj-dispatch/references/control-plane.schema.json",
        "authority_for": ["serialized-control-plane"]
      },
      {
        "id": "receipt-schema",
        "path": "skills/jj-dispatch/references/task-receipt.schema.json",
        "authority_for": ["serialized-task-receipt"]
      },
      {
        "id": "control-plane-runtime",
        "path": "src/dispatchControlPlane.mjs",
        "authority_for": ["control-plane-transitions"]
      },
      {
        "id": "tick-runtime",
        "path": "src/dispatchRuntime.mjs",
        "authority_for": ["tick-receipt-cas"]
      },
      {
        "id": "dispatch-host-runtime-contract",
        "path": "src/dispatchHostContract.mjs",
        "authority_for": ["host-action-envelope", "host-access-policy"]
      },
      {
        "id": "dispatch-host-skill-contract",
        "path": "skills/jj-dispatch/references/host-action-contract.json",
        "authority_for": ["host-action-allowlist", "dispatch-protocol-enums"]
      },
      {
        "id": "dispatch-contract-tests",
        "path": "tests/jj-dispatch-contract.test.mjs",
        "authority_for": ["dispatch-regression-evidence"]
      },
      {
        "id": "runtime-tests",
        "path": "tests/dispatch-runtime.test.mjs",
        "authority_for": ["runtime-regression-evidence"]
      },
      {
        "id": "scenario-runtime",
        "path": "src/scenarioRunner.mjs",
        "authority_for": ["deterministic-scenario-registry", "scenario-report-runtime"]
      },
      {
        "id": "trace-runtime",
        "path": "src/dispatchTrace.mjs",
        "authority_for": ["trace-envelope", "pure-state-replay"]
      },
      {
        "id": "handoff-runtime",
        "path": "src/handoffContract.mjs",
        "authority_for": ["same-handoff-validation"]
      },
      {
        "id": "scenario-report-schema",
        "path": "schemas/scenario-report.schema.json",
        "authority_for": ["serialized-scenario-report"]
      },
      {
        "id": "dispatch-trace-schema",
        "path": "schemas/dispatch-trace.schema.json",
        "authority_for": ["serialized-dispatch-trace"]
      },
      {
        "id": "scenario-tests",
        "path": "tests/scenario-runner.test.mjs",
        "authority_for": ["scenario-replay-regression-evidence"]
      },
      {
        "id": "host-trial-runtime",
        "path": "src/hostTrialRunner.mjs",
        "authority_for": ["semi-real-host-trial", "a2-a3-trial-runtime"]
      },
      {
        "id": "host-trial-evidence",
        "path": "docs/milestones/m7-host-trial.json",
        "authority_for": ["m7-acceptance-evidence", "host-trial-attention-cost"]
      },
      {
        "id": "real-host-acceptance",
        "path": "docs/milestones/real-host-acceptance.md",
        "authority_for": ["real-codex-app-host-pending", "autonomy-upgrade-gate"]
      },
      {
        "id": "grok-host-adapter-design",
        "path": "docs/design-docs/grok-host-adapter.md",
        "authority_for": ["grok-host-adapter-target-state", "multi-host-wave2"]
      },
      {
        "id": "grok-host-adapter-runtime",
        "path": "src/grokHostAdapter.mjs",
        "authority_for": ["grok-host-adapter-runtime", "wave2-fail-closed-evaluator"]
      },
      {
        "id": "grok-trial-runtime",
        "path": "src/grokHostTrialRunner.mjs",
        "authority_for": ["real-grok-host-trial-runtime"]
      },
      {
        "id": "grok-trial-evidence",
        "path": "docs/milestones/real-host-trial-grok.json",
        "authority_for": ["real-grok-host-trial-evidence"]
      },
      {
        "id": "grok-trial-tests",
        "path": "tests/grok-host-trial.test.mjs",
        "authority_for": ["real-grok-host-trial-regression"]
      },
      {
        "id": "ai-native-sdlc-design",
        "path": "docs/design-docs/ai-native-sdlc.md",
        "authority_for": ["ai-native-sdlc-target-state", "playbook-alignment"]
      },
      {
        "id": "jj-flow-labs-design",
        "path": "docs/design-docs/jj-flow-labs.md",
        "authority_for": ["lab-loop-gym", "lab-family-gym"]
      },
      {
        "id": "host-trial-tests",
        "path": "tests/host-trial.test.mjs",
        "authority_for": ["host-trial-regression-evidence"]
      },
      {
        "id": "grok-host-contract-tests",
        "path": "tests/grok-host-contract.test.mjs",
        "authority_for": ["grok-host-phase1-contract", "multi-host-handle-kind"]
      },
      {
        "id": "harness-gc-runtime",
        "path": "src/harnessGc.mjs",
        "authority_for": ["entropy-scan", "quality-score"]
      },
      {
        "id": "harness-gc-baseline",
        "path": "docs/milestones/h5-gc-baseline.json",
        "authority_for": ["h5-acceptance-evidence", "maintenance-baseline"]
      },
      {
        "id": "harness-gc-tests",
        "path": "tests/harness-gc.test.mjs",
        "authority_for": ["harness-gc-regression-evidence"]
      },
      {
        "id": "harness-gardener-workflow",
        "path": ".github/workflows/harness-gardener.yml",
        "authority_for": ["scheduled-entropy-scan", "blocking-drift-issue"]
      }
    ],
    "historical_paths": [
      {
        "path": "docs/other",
        "reason": "历史方案与演示材料，不作为当前产品或 Harness 决策来源。"
      }
    ],
    "forbidden_paths": [".workflow"]
  },
  "required_links": [
    {
      "source": "AGENTS.md",
      "contains": "ARCHITECTURE.md"
    },
    {
      "source": "AGENTS.md",
      "contains": "docs/design-docs/index.md"
    },
    {
      "source": "ARCHITECTURE.md",
      "contains": "docs/design-docs/"
    },
    {
      "source": "docs/index.md",
      "contains": "design-docs/harness-engineering.md"
    },
    {
      "source": "docs/design-docs/index.md",
      "contains": "harness-engineering.md"
    },
    {
      "source": "docs/design-docs/index.md",
      "contains": "../exec-plans/index.md"
    },
    {
      "source": "docs/index.md",
      "contains": "adr/index.md"
    },
    {
      "source": "docs/index.md",
      "contains": "milestones/m7-acceptance.md"
    },
    {
      "source": "docs/index.md",
      "contains": "milestones/h5-acceptance.md"
    },
    {
      "source": "docs/index.md",
      "contains": "milestones/real-host-acceptance.md"
    },
    {
      "source": "docs/index.md",
      "contains": "exec-plans/index.md"
    },
    {
      "source": "skills/jj-dispatch/SKILL.md",
      "contains": "references/host-action-contract.json"
    }